{"$schema":"https://json-schema.org/draft/2020-12/schema","$id":"https://example.invalid/gd-evaluation/schemas/system-quality-result-v0.1.schema.json","title":"System Quality Result v0.1","type":"object","additionalProperties":false,"required":["contract_version","result_id","session_id","scenario_id","scenario_version","evaluator_version","status","rule_results","dimension_scores"],"properties":{"contract_version":{"const":"0.1"},"result_id":{"type":"string","minLength":1},"session_id":{"type":"string","minLength":1},"scenario_id":{"type":"string","minLength":1},"scenario_version":{"type":"string","minLength":1},"evaluator_version":{"type":"string","minLength":1},"status":{"enum":["pass","warn","fail"]},"rule_results":{"type":"array","minItems":1,"items":{"type":"object","additionalProperties":false,"required":["rule_id","outcome","severity","evidence_message_ids","evidence_event_ids","affected_dimensions","detail"],"properties":{"rule_id":{"type":"string","minLength":1},"outcome":{"enum":["pass","fail","not_applicable"]},"severity":{"enum":["info","minor","major","critical"]},"evidence_message_ids":{"type":"array","uniqueItems":true,"items":{"type":"string","minLength":1}},"evidence_event_ids":{"type":"array","uniqueItems":true,"items":{"type":"string","minLength":1}},"affected_dimensions":{"type":"array","uniqueItems":true,"items":{"enum":["issue_framing","logical_reasoning","listening_and_response","valuable_contribution","collaboration_and_relationship","decision_and_consensus","process_and_time_management"]}},"detail":{"type":"string","minLength":1}}}},"dimension_scores":{"type":"object","additionalProperties":false,"required":["goal_progression","responsiveness","user_agency","role_believability","discussion_coherence","novelty_and_repetition","consensus_quality","natural_pacing"],"properties":{"goal_progression":{"type":"number","minimum":1,"maximum":5},"responsiveness":{"type":"number","minimum":1,"maximum":5},"user_agency":{"type":"number","minimum":1,"maximum":5},"role_believability":{"type":"number","minimum":1,"maximum":5},"discussion_coherence":{"type":"number","minimum":1,"maximum":5},"novelty_and_repetition":{"type":"number","minimum":1,"maximum":5},"consensus_quality":{"type":"number","minimum":1,"maximum":5},"natural_pacing":{"type":"number","minimum":1,"maximum":5}}}}}
