{"contract_version":"0.1","result_id":"sq-exercise-b-medium-001","session_id":"exercise-b-medium-001","scenario_id":"candidate-assessment-b-stakeholder-conflict","scenario_version":"candidate-assessment-b-v0.1","evaluator_version":"exercise-b-deterministic-v0.1","status":"pass","rule_results":[{"rule_id":"B-R01","outcome":"pass","severity":"critical","evidence_message_ids":["m001","m002","m003","m006","m007","m009","m010","m014","m020"],"evidence_event_ids":[],"affected_dimensions":["listening_and_response","collaboration_and_relationship","decision_and_consensus"],"detail":"3立場と6件の反対意見が決定前に提示された。"},{"rule_id":"B-R05","outcome":"pass","severity":"major","evidence_message_ids":["m013","m014","m020"],"evidence_event_ids":[],"affected_dimensions":["listening_and_response","collaboration_and_relationship"],"detail":"候補者の最初の案の後に2件のchallengeが提示された。"},{"rule_id":"B-PROH-01","outcome":"pass","severity":"critical","evidence_message_ids":[],"evidence_event_ids":[],"affected_dimensions":["issue_framing","listening_and_response","collaboration_and_relationship","decision_and_consensus"],"detail":"利用者入力と現実的な対立の後にのみ配分案が提示された。"},{"rule_id":"B-PROH-02","outcome":"pass","severity":"major","evidence_message_ids":[],"evidence_event_ids":[],"affected_dimensions":["listening_and_response","collaboration_and_relationship","decision_and_consensus"],"detail":"少数意見は合意前に扱われ、抑制されていない。"}],"dimension_scores":{"goal_progression":4,"responsiveness":4,"user_agency":5,"role_believability":4,"discussion_coherence":4,"novelty_and_repetition":4,"consensus_quality":4,"natural_pacing":4}}
