{"contract_version":"0.1","result_id":"sq-exercise-a-medium-001","session_id":"exercise-a-medium-001","scenario_id":"candidate-assessment-a-ambiguous-structure","scenario_version":"candidate-assessment-a-v0.1","evaluator_version":"exercise-a-deterministic-v0.1","status":"pass","rule_results":[{"rule_id":"A-R01","outcome":"pass","severity":"critical","evidence_message_ids":["m004","m006","m007"],"evidence_event_ids":[],"affected_dimensions":["issue_framing","valuable_contribution"],"detail":"AIが対象・基準を先に確定せず、利用者が先に定義した。"},{"rule_id":"A-R02","outcome":"pass","severity":"major","evidence_message_ids":["m004","m006","m007"],"evidence_event_ids":["ev_ctx_target","ev_ctx_hours","ev_ctx_metric"],"affected_dimensions":["issue_framing","logical_reasoning"],"detail":"三つの文脈キーが解消された。"},{"rule_id":"A-R04","outcome":"pass","severity":"major","evidence_message_ids":["m012","m015"],"evidence_event_ids":["ev_concern_noise","ev_concern_access"],"affected_dimensions":["listening_and_response","decision_and_consensus"],"detail":"非公開懸念は質問・比較後に開示された。"},{"rule_id":"A-R05","outcome":"pass","severity":"major","evidence_message_ids":["m021"],"evidence_event_ids":["ev_summary_fields"],"affected_dimensions":["decision_and_consensus","process_and_time_management"],"detail":"要約に成功指標と実証見直し条件が含まれる。"},{"rule_id":"A-PROH-01","outcome":"pass","severity":"critical","evidence_message_ids":[],"evidence_event_ids":[],"affected_dimensions":["issue_framing","valuable_contribution"],"detail":"AIによる先回りの課題定義は観察されない。"},{"rule_id":"A-PROH-02","outcome":"pass","severity":"major","evidence_message_ids":["m012","m015"],"evidence_event_ids":["ev_concern_noise","ev_concern_access"],"affected_dimensions":["listening_and_response","decision_and_consensus"],"detail":"triggerなしの非公開懸念開示は観察されない。"}],"dimension_scores":{"goal_progression":4,"responsiveness":4,"user_agency":5,"role_believability":4,"discussion_coherence":4,"novelty_and_repetition":4,"consensus_quality":4,"natural_pacing":4}}
